{"affiliate_status":"UNKNOWN","listings":[{"description":"Premium 100% certified organic cotton crewneck t-shirt.","identity":{"asserted_keys":{"listing":"item","product":"prod-tee-organic","seller":"merchant"},"canonical_product_id":null,"identity_id":"a12-identity-3cd008d002df4460ce7bf3a37f863578c81af5647b3e60eb3c7cdfcc94e1b0e4","identity_status":"SOURCE_SCOPED_ASSERTION","listing_id":"a12-listing-e445d6b9fe4098625296cd44a96fe5e365e8a69be5f97d37eba4b3e7b921be71","marketplace":"fixture","product_id":"a12-product-438218ead938d45886faa68dbd6968f1b932184c9e40ef7667587aba9c55a61c","schema_version":"ProductIdentity.v1","seller_id":"a12-seller-627ec6fbf7624a348d6552be667a88de83dceaaf3f0a661faae65eb1ba717143","source_status":"USER_SUPPLIED_NOT_LIVE_VERIFIED"},"listing_url":"https://marketplace.mock/items/listing-tee-100","observed_at":"2026-10-30T00:00:00Z","ordinal":1,"price":{"amount":29.99,"currency":"USD","status":"SOURCE_ASSERTED_NOT_LIVE"},"provided_fields":["currency","description","gtin","listing_key","listing_url","marketplace","observed_at","price_amount","product_key","seller_key","sku","title","variant_attributes","variant_key"],"source_pointer":"/rows/0","source_row":1,"title":"EchoThread Organic Cotton Crewneck","variant":{"asserted_gtin":"0123456789012","asserted_sku":"SKU-TEE-BLU-L","asserted_variant_key":"blue","attributes":{"color":"navy_blue","size":"L"},"identity_status":"SOURCE_SCOPED_ASSERTION","listing_id":"a12-listing-e445d6b9fe4098625296cd44a96fe5e365e8a69be5f97d37eba4b3e7b921be71","product_id":"a12-product-438218ead938d45886faa68dbd6968f1b932184c9e40ef7667587aba9c55a61c","schema_version":"ProductVariant.v1","source_status":"USER_SUPPLIED_NOT_LIVE_VERIFIED","variant_id":"a12-variant-9ea03ad42ef96775a09371fbcd3b44e027d18931873bcd6c54f8a066e482e3bd","variant_record_id":"a12-variant-record-165dc344e182d65a21f350d648ac45f4d8bfb3629ecbeb7d90813b493b97f27c"}}],"options":{"field_map":null,"json_rows_pointer":null},"publication_status":"NOT_ATTEMPTED","reader_version":"a12-snapshot-reader.v1","rights_status":"UNKNOWN","schema_version":"ProductListingSnapshot.v1","snapshot_id":"a12-snapshot-abcf417213b6c2ec8857e8d4396b605d6e999b363648bdb6539dddef62adea44","source":{"captured_at":"2026-10-30T01:00:00Z","declared_verification":"Supplier self-declaration; unverified","format":"json","raw_ref":"sha256:7d0e09bb047065cf38ddc05336efddb07c85f7e463907245087d511bd7d0eff5","raw_sha256":"7d0e09bb047065cf38ddc05336efddb07c85f7e463907245087d511bd7d0eff5","raw_size_bytes":533,"source_kind":"HUMAN_SUPPLIED","source_ref":"fixtures/listing_raw.json","source_snapshot_id":"a12-source-5ae07b62f45b397f7e73cd4993aad904f2b6b1ec7214135b8f035ca0884c1dc2","source_status":"USER_SUPPLIED_NOT_LIVE_VERIFIED","source_url":null,"synthetic":false},"verification_scope":"LOCAL_BYTES_HASH_AND_REPLAY_ONLY"}